{
  "id": "01jrcasebox0000000000000m4",
  "tenant_id": "tenant-local-v1",
  "actor_user_id": "local-user",
  "name": "ACME counsel matter — superseded by litigation matter m5",
  "jurisdiction": { "value": "cn-sh", "locked": false },
  "matter_type": "advisory",
  "parties": [
    { "role": "client", "display_name": "ACME Corp", "party_kind": "organization" }
  ],
  "confidentiality_class": "normal",
  "status": "active",
  "external_ocr_authorized": false,
  "sync_grant_present": false,
  "llm_extraction_opt_in": false,
  "created_at": "2026-04-01T09:00:00.000Z",
  "successor_matter_id": "01jrcasebox0000000000000m5"
}
