{
  "id": "01jrcasebox0000000000000m1",
  "tenant_id": "tenant-local-v1",
  "actor_user_id": "local-user",
  "name": "Test Matter — Sample Litigation",
  "jurisdiction": {
    "value": "cn-sh",
    "locked": false
  },
  "matter_type": "litigation",
  "parties": [
    { "role": "client",   "display_name": "ACME Corp",       "party_kind": "organization" },
    { "role": "opposing", "display_name": "Counterparty Ltd", "party_kind": "organization" }
  ],
  "retainer_scope": "General representation for the dispute described in Engagement Letter dated 2026-01-15.",
  "confidentiality_class": "normal",
  "status": "active",
  "external_ocr_authorized": false,
  "sync_grant_present": false,
  "llm_extraction_opt_in": false,
  "created_at": "2026-05-20T09:00:00.000Z"
}
